company,summary,sentiment,summary_validation,sentiment_explanation,sentiment_score
Permian Basin Petroleum Association (PBPA),"The document is a letter submitted by the Permian Basin Petroleum Association (PBPA) to the Environmental Protection Agency (EPA) regarding the proposed revisions to the Greenhouse Gas Reporting Rule (GHGRP) for petroleum and natural gas systems. The PBPA represents oil and gas industry workers in the Permian Basin, the largest oil and gas producing region in the world.

The letter begins by stating that the proposed rule would significantly increase the number of oil and gas operators subject to methane emissions reporting requirements. The PBPA argues that this expansion is not consistent with the Intentional Reduction Act (IRA), which exempts certain operations from emissions fees. They claim that the proposed rule would impact small and medium-sized producers, contrary to the intent of the legislation.

The PBPA criticizes the proposed rule for being based on faulty modeling, data, and analysis. They argue that the rule fails to achieve its intended purpose of reducing emissions and would have no benefit to the environment or the economy. The PBPA suggests that the rule should be withdrawn and revised to align with the IRA and the intent of Congress.

The letter also highlights specific technical flaws in the proposed rule. The PBPA argues that the rule does not incentivize the use of proven monitoring technologies and instead imposes unrealistic emission factors. They provide examples of how these flaws would result in unrealistic and inflated emission totals, which would negatively impact their members' reputation and finances.

Furthermore, the PBPA criticizes the EPA for incorporating requirements from other proposed rules, such as the New Source Performance Standards (NSPS) and Emissions Guidelines (EG), which have not been finalized. They argue that referencing these rules in the GHGRP proposal is presumptive and could lead to inconsistencies and confusion.

The letter concludes by requesting that the EPA revise the proposed rule to ensure that reporting is based on empirical data and aligns with the IRA and the intent of Congress. The PBPA emphasizes the importance of accurate reporting without imposing unnecessary costs or inaccuracies.

Overall, the document provides a detailed critique of the proposed revisions to the GHGRP for petroleum and natural gas systems, highlighting technical flaws, inconsistencies, and concerns about the impact on oil and gas operators.",negative,"Based on the text provided, the statement is true. The document is a letter submitted by the Permian Basin Petroleum Association (PBPA) to the Environmental Protection Agency (EPA) regarding the proposed revisions to the Greenhouse Gas Reporting Rule (GHGRP) for petroleum and natural gas systems. The PBPA represents oil and gas industry workers in the Permian Basin, which is the largest oil and gas producing region in the world. The letter discusses the PBPA's concerns about the proposed rule, including its impact on small and medium-sized producers, faulty modeling and analysis, and inconsistencies with other proposed rules.","Explanation:
The sentiment of this document is negative with a score of -0.8. This is because the document expresses concerns and criticisms regarding the proposed rule by the Environmental Protection Agency (EPA) on Greenhouse Gas Reporting. The document highlights flaws in the proposed rule, such as the potential increase in reporting requirements for small and mid-sized operations, faulty modeling and data analysis, unrealistic emission factors, and inconsistencies with other rules. The overall tone of the document is critical and suggests a negative sentiment towards the proposed rule.",-0.8
Michigan Oil and Gas Association (MOGA),"The document is a letter from the Michigan Oil and Gas Association (MOGA) to the EPA Administrator, Michael S. Regan, regarding the proposed Revisions and Confidentiality Determination for Petroleum and Natural Gas System. MOGA represents small businesses engaged in the oil and gas industry in Michigan and seeks to provide input on the potential impacts of the proposed rule.

MOGA initially intended to request an extension for commenting on the proposed modifications due to the complexity and integration of various regulations related to methane emissions reduction. However, after reviewing the EPA's denial letters for extension requests, MOGA decided to provide comments instead. The organization supports other commenters who called for the withdrawal of the proposed rule until other related regulations are finalized.

MOGA urges the EPA to consider the concerns of small businesses in the industry before finalizing regulations that may be technically and financially infeasible. They emphasize the importance of small businesses being able to understand and implement regulations for compliance success. However, MOGA states that the current state of proposed regulations is interrelated and difficult to understand, making it challenging to provide sufficient comment on the potential impacts to the industry.

The letter then provides several specific comments on surficial issues proposed in the regulations:

1. Department of Energy (DOE) Marginal Well Study: MOGA recommends including the results of the DOE study, which clarified the differences in potential emissions from marginal wells vs. non-marginal wells, in the proposed emission factors for revisions to Subpart W.

2. Imperial vs. Metric: MOGA argues that all proposed regulations should use accepted methodologies and cater to the least common denominator in terms of raw data collection. They suggest that unnecessary conversions between different units of measurement may lead to incorrect data sets and improper conclusions.

3. Approval of Independent Engineering Calculations for Emission Determination: MOGA applauds the EPA for allowing independent emission determination using alternative procedures and calculations. However, they express concern about the lack of clarification, defined procedures, and response time for the EPA's approval process. MOGA believes that a detailed process and procedure, including a specified time for approval, are necessary for providing specific comments on the proposed regulations.

4. Off-Ramp Inclusion: MOGA supports the EPA's proposal to allow temporary or final cessation of reporting when emissions fall below certain levels. However, they are concerned about the potential costs associated with continued reporting during this timeframe. They argue that when throughput declines to marginal well levels, continued reporting will add untenable costs and may lead to early well plugging. MOGA suggests removing subsequent reporting after off-ramping or reducing the reporting timeframe to two years to account for depletion.

5. Clarification of Exemptions proposed in NSPS OOOOb & OOOOc and the IRA: MOGA states that the exemptions proposed in these regulations are not clear or specifically outlined. They recommend that the EPA specify exemptions before requesting comments on modifications to the Subpart W calculations that may have financial implications.

6. Regulation Dates & Timelines: MOGA expresses concern about the variation in proposed regulation timelines. They highlight that the IRA and subsequent Waste Emission Charges are set to take place in 2024, while the proposed calculation methodologies for Subpart W will not take effect until January 1, 2025. MOGA is concerned that emission estimates may be overstated, resulting in taxation beyond actual estimates before independent analysis of actual emissions is allowed. They believe that proposed regulations should align to allow inclusion of actual emissions.

7. Estimated vs. Actual Emissions: MOGA's constituents are concerned that current and proposed Subpart W emissions factors overestimate emissions and do not accurately reflect actual emissions. They recommend that the EPA develop and propose specific, cost-efficient methodologies that would allow all operators, including small businesses, to calculate actual emissions.

In conclusion, MOGA appreciates the opportunity to comment on the proposed Subpart W modifications but finds the timing of the proposed regulations inconsistent with unfinalized concurrent regulations that may impact the current proposed regulations. They recommend that the EPA withdraw the proposed Subpart W regulations until further clarification and finalization of parallel proposed regulations are complete.",negative,"Based on the text provided, the statement is true. The document is indeed a letter from the Michigan Oil and Gas Association (MOGA) to the EPA Administrator, Michael S. Regan, regarding the proposed Revisions and Confidentiality Determination for Petroleum and Natural Gas System. MOGA represents small businesses engaged in the oil and gas industry in Michigan and seeks to provide input on the potential impacts of the proposed rule. The letter outlines MOGA's concerns and specific comments on various issues proposed in the regulations.","Explanation:
The sentiment of this document is negative with a score of -0.6. 

1. The document expresses concerns and dissatisfaction with the proposed revisions and regulations by the EPA, indicating a negative sentiment towards the topic.
2. The document highlights the complexity and integration of the proposed modifications, which are described as overwhelming and difficult to understand. This indicates frustration and dissatisfaction, contributing to the negative sentiment.
3. The document emphasizes the need for the EPA to listen to the concerns of small businesses and suggests that the proposed regulations are technically and financially infeasible. This reflects a negative sentiment towards the EPA's approach.
4. The document raises several specific issues and criticisms regarding the proposed regulations, such as the exclusion of the Department of Energy study results, the use of metric units instead of the industry standard, lack of clarification on procedures, and concerns about reporting costs. These criticisms contribute to the negative sentiment expressed in the document.
5. The document recommends the withdrawal of the proposed regulations until further clarification and finalization of parallel regulations, indicating a lack of confidence and dissatisfaction with the current state of the proposed regulations.

Overall, the document consistently expresses negative sentiment towards the proposed revisions and regulations, highlighting concerns, frustrations, and dissatisfaction with various aspects of the proposed rules.",-0.6
Interfaith Center on Corporate Responsibility (ICCR),"The document is a comment submitted to the U.S. Environmental Protection Agency (EPA) regarding the proposed Greenhouse Gas Reporting Rule: Revisions and Confidentiality Determinations for Petroleum and Natural Gas Systems. The comment is submitted by the Interfaith Center on Corporate Responsibility (ICCR), a global coalition of faith-based and values-driven institutional investors.

ICCR supports the EPA's proposed rule to update Subpart W of the Greenhouse Gas Reporting Program (GHGRP) to fulfill the Congressional directive in the IRA's Methane Emissions Reduction Program (MERP). The comment emphasizes the importance of addressing methane emissions, as methane is a powerful climate change forcer. The ICCR expresses concern about the impact of climate change on the economy, companies, and vulnerable communities.

The comment highlights that methane emissions from oil and gas infrastructure represent wasted natural resources, increased warming impact, safety and reputational risks, and a failure to capture valuable product. It argues that addressing methane emissions is one of the fastest and most cost-effective means of limiting global warming.

ICCR supports the EPA's proposal to ensure reporting is based on empirical data and accurately reflects total methane emissions from oil and gas facilities. The comment suggests integrating top-down, basin-level data alongside site- and equipment-level measurement data to provide a full picture of total emissions in a region. It also recommends building in appropriate statistical analysis of measurement data to account for intermittent emission events and requiring independent verification for self-reported measurements from companies.

The comment emphasizes that accurate reporting would build investor confidence, create transparency around emissions performance, and ensure U.S. companies remain competitive in global markets. It encourages the EPA to move swiftly to finalize the proposed rule.

The document does not mention continuous emissions monitoring, alternative technologies, harmonization, or the terms ""arbitrary and capricious.""",positive,"Based on the text provided, the statement is true. The document is a comment submitted to the U.S. Environmental Protection Agency (EPA) regarding the proposed Greenhouse Gas Reporting Rule: Revisions and Confidentiality Determinations for Petroleum and Natural Gas Systems. The comment is submitted by the Interfaith Center on Corporate Responsibility (ICCR), a global coalition of faith-based and values-driven institutional investors. The comment supports the EPA's proposed rule to update Subpart W of the Greenhouse Gas Reporting Program (GHGRP) to fulfill the Congressional directive in the IRA's Methane Emissions Reduction Program (MERP). The comment emphasizes the importance of addressing methane emissions and highlights the impact of climate change on the economy, companies, and vulnerable communities. The comment also supports the EPA's proposal to ensure reporting is based on empirical data and accurately reflects total methane emissions from oil and gas facilities.","Explanation:
The sentiment of this document is positive with a score of 0.6. 

The document expresses support for the Environmental Protection Agency's proposed rule to update Subpart W of the Greenhouse Gas Reporting Program. It highlights the concerns of investors regarding methane emissions and their impact on climate change, the economy, and vulnerable communities. The document also emphasizes the need for robust government regulations to address methane waste and improve data reporting in the oil and gas industry. It argues for the importance of accurate reporting based on real-world empirical data to assess company performance and mitigate methane-related risks. The document suggests improvements to the proposed rule to enhance accuracy and transparency in reporting. Overall, the document conveys a positive sentiment towards the EPA's efforts and the importance of addressing methane emissions.",0.6
"AQC Environmental Brokerage Services, Inc.","The document is a response to the U.S. Environmental Protection Agency's (EPA) proposed rule ""Greenhouse Gas Reporting Rule: Revisions and Confidentiality Determinations for Petroleum and Natural Gas Systems."" The specific section being addressed is ""4. Compressors Routed to Controls."" 

The EPA is proposing to remove references to thermal oxidizers as emissions dispositions and instead categorize emissions routed to thermal oxidizers as ""routed to combustion."" The author of the response letter disagrees with this proposal and argues for the retention of references to thermal oxidizers while adding a specification for whether the thermal oxidizers incorporate energy recovery or not. 

The author provides several key considerations for retaining references to thermal oxidizers and adding the energy recovery specification. Firstly, they argue that it contributes to regulatory clarity and consistency, aligning with prevailing industry norms and providing clarity on the control technology in operation. Secondly, they suggest that it further incentivizes technological advancements by promoting cleaner technologies and fostering innovation in emissions mitigation. 

Thirdly, the author argues that retaining references to thermal oxidizers ensures precise emissions accounting and improved data elements. They believe that substituting the term ""routed to combustion"" may introduce ambiguity into emissions reporting and that distinguishing between thermal oxidizers with and without energy recovery would provide more accurate data for informed decision-making. 

Fourthly, the author highlights the importance of aligning with methane emissions reduction efforts. They state that thermal oxidizers play a pivotal role in mitigating methane emissions and that their retention in reporting frameworks facilitates a more accurate evaluation of advancements in curbing methane emissions across industries. They argue that removing references to thermal oxidizers could discourage the adoption of cleaner emission control technologies and impede progress towards sustainable emission reduction practices. 

Lastly, the author emphasizes that thermal oxidizers are an effective methane mitigation technology, citing data from the EPA's Inventory of U.S. Greenhouse Gas Emissions and Sinks. They suggest that enabling reporting under Subpart C for compressors and pneumatic controllers that utilize thermal oxidizers can hasten the reduction of fugitive methane emissions. 

In conclusion, the author urges the EPA to retain references to thermal oxidizers under Subpart W, arguing that it provides regulatory clarity, supports industry adoption of responsible emission control practices, and aligns with the EPA's methane emissions reduction objectives. They recommend a balanced approach that minimizes reporting burdens, encourages the use of beneficial emission control technologies, and allows for reporting under Subpart C for thermal oxidizers in compressors and pneumatic controllers.",positive,"Based on the text provided, the statement is true. The document is indeed a response to the U.S. Environmental Protection Agency's (EPA) proposed rule ""Greenhouse Gas Reporting Rule: Revisions and Confidentiality Determinations for Petroleum and Natural Gas Systems."" The specific section being addressed is ""4. Compressors Routed to Controls."" The author of the response letter disagrees with the proposal to remove references to thermal oxidizers and argues for their retention while adding a specification for whether the thermal oxidizers incorporate energy recovery or not. The author provides several key considerations for retaining references to thermal oxidizers and adding the energy recovery specification, including regulatory clarity and consistency, incentivizing technological advancements, precise emissions accounting, aligning with methane emissions reduction efforts, and the effectiveness of thermal oxidizers as a methane mitigation technology.","Explanation:
The sentiment of this document is positive with a score of 0.8. 

The document expresses support for the retention of references to thermal oxidizers in the proposed ""Greenhouse Gas Reporting Rule: Revisions and Confidentiality Determinations for Petroleum and Natural Gas Systems."" It argues for the inclusion of a specification regarding the energy recovery capabilities of thermal oxidizers and emphasizes the benefits of thermal oxidizers in emissions reduction and energy harnessing. The document also highlights the importance of regulatory clarity, consistency, and precise emissions accounting, as well as the alignment with methane emissions reduction efforts. It concludes by urging the EPA to consider the challenges and effects of the proposed amendments and recommends a balanced approach that encourages the use of beneficial emission control technologies while achieving the intended results in reporting. Overall, the document presents a well-reasoned and positive perspective on the topic, supporting the retention of references to thermal oxidizers.",0.8
American Petroleum Institute (API),"The document is a memorandum from Karin Ritter, Manager of Corporate Policy at the American Petroleum Institute (API), to Mark DeFigueiredo, Melissa Weitz, and Adam Eisele of the U.S. Environmental Protection Agency (EPA) Climate Change Division. The memorandum provides the results of the API Field Measurement Study of Pneumatic Controllers and proposes a two-tiered emission factor for controllers.

The API field study found that the average emission rate for properly functioning intermittent controllers was 0.28 standard cubic feet per hour (scfh), while malfunctioning intermittent controllers had an average emission rate of 24.1 scfh. The overall average emission rate for all intermittent controllers was 9.3 scfh. Continuous low bleed controllers had an average emission rate of 2.6 scfh, and continuous high bleed controllers had an average emission rate of 16.4 scfh. Malfunctioning intermittent pneumatic controllers accounted for about 85% of observed pneumatic controller emissions and 98% of observed intermittent pneumatic controller emissions.

These results are consistent with prior studies that found a small number of malfunctioning intermittent controllers accounted for the majority of pneumatic controller emissions. Based on these findings, API proposes that EPA modify 40 CFR Part 98 Subpart W to include a two-tier intermittent pneumatic controller emission factor option for controllers included in a qualified inspection and repair program. The proposed emission factors are 0.28 scfh for properly functioning controllers and 24.1 scfh for malfunctioning controllers. Intermittent controllers not included in a qualified inspection and repair program would continue to use the current emission factor of 13.5 scfh.

API suggests that EPA may wish to include data from prior studies to calculate a set of tiered emission factors from a wider dataset. The document also mentions that OGI inspection of intermittent pneumatic controllers is the technique used by EPA and the Colorado Department of Public Health and Environment in their recently published study.

The document includes an API paper titled ""Pneumatic Controller Inventory and Measurement at 67 Oil and Gas Sites in the Western United States,"" an excel file with data tables for the study, and API's responses to EPA's questions received prior to a conference call on January 13, 2020.

Overall, the document highlights the need for a two-tiered emission factor for intermittent pneumatic controllers based on their functioning status and proposes that EPA modify regulations to include this option. The proposed approach aims to incentivize voluntary inspections and repairs of malfunctioning controllers to reduce emissions and improve the accuracy of emissions reporting.",positive,"Based on the text provided, the statement is true. The document is a memorandum from Karin Ritter, Manager of Corporate Policy at the American Petroleum Institute (API), to Mark DeFigueiredo, Melissa Weitz, and Adam Eisele of the U.S. Environmental Protection Agency (EPA) Climate Change Division. The memorandum discusses the API Field Measurement Study of Pneumatic Controllers and proposes a two-tiered emission factor for controllers. The study found that malfunctioning intermittent controllers accounted for about 85% of observed pneumatic controller emissions and 98% of observed intermittent pneumatic controller emissions. API proposes that EPA modify regulations to include a two-tiered emission factor option for controllers included in a qualified inspection and repair program. The proposed emission factors are 0.28 scfh for properly functioning controllers and 24.1 scfh for malfunctioning controllers.","Explanation:
The sentiment of this document is positive with a score of 0.8. This is because the document discusses the results of a study conducted by the American Petroleum Institute (API) on pneumatic controllers and proposes a two-tiered emission factor for controllers. The document highlights that the API study found that a small number of malfunctioning intermittent controllers accounted for the majority of pneumatic controller emissions. The proposed emission factor aims to incentivize operators to conduct inspections and repairs to identify and reduce emissions from malfunctioning controllers. The document also mentions that the API's proposal is consistent with prior studies and suggests the use of optical gas imaging for inspection. Overall, the document presents a proactive approach to addressing emissions from pneumatic controllers, which contributes to the positive sentiment.",0.8
