company,summary,sentiment,summary_validation,sentiment_explanation,sentiment_score
Honeywell International Inc.,"The document is a comment submitted by Honeywell International Inc. to the U.S. Environmental Protection Agency (EPA) regarding the proposed revisions to Subpart W of the Greenhouse Gas Reporting Program regulations. Honeywell is a manufacturer of gas leak detection systems used in the oil and gas industry. The company provides recommendations to the EPA on how to improve the accuracy of emissions reporting and promote the use of continuous monitoring technologies.

Honeywell highlights its expertise in gas leak detection technologies, including fixed, portable, and continuous systems. They mention their Rebellion™ Gas Cloud Imaging (GCI) cameras, which use hyperspectral imaging technology to detect and quantify gas leaks in real-time. They also mention their Versatilis™ Signal Scout™ technology, which is a wireless gas leak detection system that allows for continuous monitoring and prevention of leaks across a facility.

Honeywell supports the EPA's efforts to revise Subpart W to ensure that emissions reporting is based on empirical data and accurately reflects total methane emissions and waste emissions from applicable facilities. They also support the proposal to permit the use of emissions data from remote sensing approaches to identify and calculate emission rates for ""other large release events.""

However, Honeywell expresses concern that the proposed revisions to Subpart W are overly prescriptive and do not adequately consider the use of continuous monitoring technologies. They argue that continuous monitoring technologies, such as their Rebellion™ GCI cameras and Signal Scout™ sensors, can provide more accurate and timely detection and quantification of emissions compared to periodic surveys or other methods currently permitted under Subpart W. They recommend that EPA incorporate the use of continuous monitoring technologies into leak detection survey methods and allow owners and operators to incorporate empirical data from these technologies into their emissions reporting.

Honeywell also suggests that EPA should allow advanced technology manufacturers to demonstrate the beneficial use of continuous monitoring systems to enhance the accuracy of emissions data reporting for Subpart W. They argue that continuous monitoring systems can improve the ability to detect and respond to intermittent emissions, improve upon the use of emissions factors for emission quantification, and provide more accurate and reliable data for emissions accounting.

In conclusion, Honeywell encourages EPA to revise Subpart W to allow for the use of empirical data from continuous monitoring technologies, which they believe will improve the accuracy of emissions reporting and provide operators with valuable data for emissions reduction efforts. They emphasize the need for EPA to consider the advantages of continuous monitoring systems and avoid overly prescriptive regulations that may deter their use.",positive,"Based on the text provided, the statement is true. The document is a comment submitted by Honeywell International Inc. to the U.S. Environmental Protection Agency (EPA) regarding the proposed revisions to Subpart W of the Greenhouse Gas Reporting Program regulations. Honeywell, a manufacturer of gas leak detection systems used in the oil and gas industry, provides recommendations to the EPA on how to improve the accuracy of emissions reporting and promote the use of continuous monitoring technologies. The document highlights Honeywell's expertise in gas leak detection technologies, including their Rebellion™ Gas Cloud Imaging (GCI) cameras and Versatilis™ Signal Scout™ technology. Honeywell supports the EPA's efforts to revise Subpart W but expresses concern that the proposed revisions are overly prescriptive and do not adequately consider the use of continuous monitoring technologies. They recommend that the EPA incorporate the use of continuous monitoring technologies into leak detection survey methods and allow owners and operators to incorporate empirical data from these technologies into their emissions reporting.","Explanation:
The sentiment of this document is positive with a score of 0.8. The document expresses appreciation for the opportunity to provide comments on the proposed rule and acknowledges the efforts of the Environmental Protection Agency (EPA). It also highlights the capabilities of Honeywell's advanced continuous monitoring technologies and recommends their inclusion in the revisions to Subpart W. The document emphasizes the benefits of continuous monitoring systems in improving the accuracy of emissions reporting and highlights the potential flaws and limitations of current leak detection and measurement methodologies. Overall, the document conveys a positive sentiment towards the proposed revisions and the use of continuous monitoring technologies.",0.8
"Petroleum Alliance of Oklahoma, Independent Petroleum Association of America and Western Energy Alliance","The document is a letter from the Petroleum Alliance of Oklahoma, the Independent Petroleum Association of America, and Western Energy Alliance to the Environmental Protection Agency (EPA). The letter requests an extension of the public comment period by an additional 60 days for Docket Id. No. EPA-HQ-OAR-2023-0234, which pertains to the Greenhouse Gas Reporting Rule: Revisions and Confidentiality Determinations for Petroleum and Natural Gas Systems. The Trades also request that the EPA conduct a public hearing that includes a presentation on the proposed changes.

The letter highlights the importance of the Trades' members, who represent thousands of individuals and companies in the oil and gas industry. These members are involved in various sectors, including upstream, midstream, and downstream operations, and play a significant role in Oklahoma's crude oil and natural gas production.

The Trades argue that the 60-day comment period provided by the EPA is insufficient to fully review the Proposed Rule and its supporting material, which consists of 160 pages of text and 136 supporting documents. They also mention that the EPA has other proposed Greenhouse Gas Reporting Rules and New Source Performance Standards for oil and gas sources that have not been finalized, adding complexity to the review process. The Trades request the additional 60-day review time to better understand the cumulative costs and impacts of the proposed rules and provide fully informed comments.

The Trades state that the requested extension will not cause hardship on the EPA or have negative impacts on the environment or human health. They argue that providing additional time will ensure that their members can adequately review the information and provide useful comments to benefit the EPA's decision-making process.

Lastly, the Trades request that the EPA conduct a public hearing and include a presentation on the proposed changes. They believe that this will further their understanding of the Proposed Rule, given its consequences on their members and the complexity of the information involved.

Overall, the letter requests an extension of the comment period, a public hearing, and a presentation on the proposed changes to allow for a thorough review and informed comments from the Trades' members.

The document does not mention continuous emissions monitoring, alternative technologies, IRA, congressional intent, harmonize, arbitrary and capricious.",negative,"Based on the text provided, the statement is true. The document is indeed a letter from the Petroleum Alliance of Oklahoma, the Independent Petroleum Association of America, and Western Energy Alliance to the Environmental Protection Agency (EPA). The letter requests an extension of the public comment period by an additional 60 days for Docket Id. No. EPA-HQ-OAR-2023-0234, which pertains to the Greenhouse Gas Reporting Rule: Revisions and Confidentiality Determinations for Petroleum and Natural Gas Systems. The Trades also request that the EPA conduct a public hearing that includes a presentation on the proposed changes.","Explanation:
The sentiment of this document is negative with a score of -0.2. This is because the document is a request for an extension of the comment period and a public hearing regarding the proposed changes to the Greenhouse Gas Reporting Rule. The tone of the document is formal and assertive, indicating dissatisfaction with the current timeline and the need for more time to review and provide meaningful comments. The document highlights the complexity and uncertainty surrounding the proposed rules and emphasizes the potential consequences on the Trade's members. Overall, the document expresses a negative sentiment towards the current situation and the need for more time and clarity.",-0.2
"Bridger Photonics, Inc.","The document is a letter addressed to the Honorable Michael S. Regan, Administrator of the U.S. Environmental Protection Agency (EPA), regarding the EPA's proposed Greenhouse Gas Reporting Rule for revisions and confidentiality determinations for petroleum and natural gas systems. The letter is submitted by Bridger Photonics, Inc. (Bridger), a company specializing in the detection, localization, and quantification of methane emissions.

Bridger acknowledges the opportunity to provide input on the proposed rulemaking notice but requests a 30-day extension of the public comment period. They argue that the Proposed Rule is highly technical, with numerous proposed changes and far-reaching impacts, necessitating additional time for stakeholders to fully understand and provide informed comments. Bridger highlights their expertise in methane emissions measurement through their Gas Mapping LiDAR™ (GML) technology, which has been widely adopted by the oil and gas industry in North America.

The company emphasizes the need for significant resources to comprehend the Proposed Rule, exchange knowledge with other stakeholders, and convey their scientific knowledge within the context of the rule's provisions. They believe that other stakeholders will face similar challenges in providing input to the rulemaking process. Bridger asserts that an extension in the public comment period would enable them to better serve the EPA, the public, and the industry through their comments.

The letter concludes with gratitude for considering their request and provides contact information for further inquiries.

Topics covered in the document include methane emissions, the proposed Greenhouse Gas Reporting Rule, Bridger's expertise in LiDAR technology, the need for additional time to understand and comment on the rule, and the potential benefits of an extended public comment period. The document does not mention continuous emissions monitoring, alternative technologies, IRA, congressional intent, harmonize, arbitrary and capricious.",positive,"Based on the text provided, the statement is true. The document is indeed a letter addressed to the Honorable Michael S. Regan, Administrator of the U.S. Environmental Protection Agency (EPA), regarding the EPA's proposed Greenhouse Gas Reporting Rule for revisions and confidentiality determinations for petroleum and natural gas systems. The letter is submitted by Bridger Photonics, Inc. (Bridger), a company specializing in the detection, localization, and quantification of methane emissions. The letter acknowledges the opportunity to provide input on the proposed rulemaking notice but requests a 30-day extension of the public comment period. Bridger highlights their expertise in methane emissions measurement through their Gas Mapping LiDAR™ (GML) technology, which has been widely adopted by the oil and gas industry in North America. The company emphasizes the need for additional time to understand and comment on the rule and asserts that an extension in the public comment period would enable them to better serve the EPA, the public, and the industry through their comments.","Explanation:
The sentiment of this document is positive with a score of 0.4. 

The document begins by expressing appreciation for the opportunity to provide input on the proposed rulemaking, indicating a positive sentiment. The request for an extension of the public comment period is made respectfully, further indicating a positive tone. The document then highlights the technical expertise and market leadership of Bridger Photonics in the detection and quantification of methane emissions, which positions them to effectively comment on the proposed rule. This showcases their confidence and positive outlook on their capabilities. The document concludes with a polite and professional tone, expressing gratitude for the consideration of the request.

Overall, the document maintains a positive sentiment throughout, demonstrating a positive attitude, professionalism, and confidence in Bridger Photonics' ability to contribute valuable input to the proposed rulemaking.",0.4
SENSIA Solutions S.L.,"The document is a letter from SENSIA Solutions, S.L., an oil and gas technology manufacturer, to the U.S. Environmental Protection Agency (EPA) regarding the EPA's proposed Greenhouse Gas Reporting Rule. SENSIA expresses their support for the EPA's efforts to reduce methane waste emissions and improve reporting standards. 

SENSIA raises concerns about the proposed emissions factors for oil and gas producers using Optical Gas Imaging (OGI) technology for emissions measurement and reporting. They argue that the proposed higher emissions factors assigned to companies using OGI technology contradict the evidence cited in the proposed rule. They reference a study that shows OGI detects more leak events than the current method (Method 21), suggesting that OGI is a more accurate technology. SENSIA calls for a revision of the proposed emissions factor reporting guidelines to encourage the use of OGI technology and prevent potential underreporting of methane emissions.

SENSIA also suggests an alternative top-down facility-level approach for continuous monitoring of emissions. They propose using automated OGI solutions mounted on high viewpoint masts that can provide continuous monitoring of potential emissions sources from a plant. They argue that this approach would lead to more accurate and frequent emissions measurements, valuable insights for identifying root causes, and a more transparent emissions record.

SENSIA highlights two key factors for the efficient implementation of continuous monitoring systems: the minimum detectable leak rate of the OGI at different distances and the automation of detection and quantification processes to ensure traceability of measurements.

In conclusion, SENSIA appreciates the EPA's commitment to addressing methane emissions and improving reporting standards. They urge the EPA to consider their evidence and recommendations to refine the proposed rules further, encouraging the use of advanced emissions measurement technologies and alternative monitoring approaches for a more sustainable future. SENSIA offers their assistance to help achieve these environmental objectives.

The document does not specifically mention continuous emissions monitoring, alternative technologies, the Inflation Reduction Act (IRA), congressional intent, harmonize, arbitrary and capricious.",positive,"Based on the text provided, the statement is true. The document is a letter from SENSIA Solutions, an oil and gas technology manufacturer, to the U.S. Environmental Protection Agency (EPA) regarding the EPA's proposed Greenhouse Gas Reporting Rule. SENSIA expresses their support for the EPA's efforts to reduce methane waste emissions and improve reporting standards. They raise concerns about the proposed emissions factors for oil and gas producers using Optical Gas Imaging (OGI) technology and argue that the proposed higher emissions factors assigned to companies using OGI technology contradict the evidence cited in the proposed rule. SENSIA suggests revising the proposed emissions factor reporting guidelines to encourage the use of OGI technology and prevent potential underreporting of methane emissions. They also propose an alternative top-down facility-level approach for continuous monitoring of emissions using automated OGI solutions. SENSIA highlights the importance of the minimum detectable leak rate of the OGI at different distances and the automation of detection and quantification processes for efficient implementation of continuous monitoring systems. In conclusion, SENSIA appreciates the EPA's commitment and offers their assistance to help achieve environmental objectives.","Explanation:
The sentiment of the document is positive with a score of 0.6. 

The document expresses appreciation for the intentions and actions of the Environmental Protection Agency (EPA) in implementing provisions related to methane waste emission fees and greenhouse gas reporting. It highlights the expertise and reputation of SENSIA Solutions in the oil and gas industry, indicating a positive outlook for the company. The document also provides evidence and recommendations to refine proposed rules, emphasizing the use of advanced emissions measurement technologies and alternative monitoring approaches for more accurate data and a sustainable future. Overall, the document conveys a positive tone and supports the EPA's commitment to addressing methane emissions.",0.6
Planetary Emissions Management Inc.,"The document is a statement submitted by Bruno D.V. Marino, CEO and Founder of Planetary Emissions Management Inc., regarding the revisions to the Greenhouse Gas Reporting Rule (Subpart W) for the petroleum and natural gas industry. Marino expresses support for the revisions, particularly the focus on accuracy, empirical data, and direct measurement. He emphasizes the importance of differentiating between fossil and modern methane flux in commercial operations to reduce uncertainties in verifying actual net fossil fuel methane emission reductions and as a foundation for tradable emission offsets.

Marino suggests that the analysis of radiomethane, or 14C CH4, could be a solution to the problem of accurately measuring fossil fuel perturbation to the climate system. Radiomethane flux accounting is not currently achievable with existing detection methods. Radiomethane, as a fossil fuel, lacks 14C and can be measured as a decrease in the ratio of atmospheric 14C to 12C during oil and gas operations. This measurement defines a mixing line to calculate the abundance of fossil methane leakage across different project scales.

To ensure accuracy and traceability of radiomethane measurements, Marino proposes the establishment of a central reference laboratory by a third party. This laboratory would electronically verify and certify field measurements, ensuring universality and equivalence of results across all locations. Marino mentions that Planetary Emissions Management Inc. is developing radiomethane measurement technology and sensor system architecture that will provide a higher level of accuracy in distinguishing exact methane sources.

In conclusion, Marino urges the Environmental Protection Agency (EPA) to encourage and allow the use of radiomethane measurement technology in achieving the goals of the Greenhouse Gas Reporting Rule revisions.

The document does not specifically mention continuous emissions monitoring, alternative technologies, IRA, congressional intent, harmonize, arbitrary and capricious.",positive,"Based on the text provided, the statement is true. The document is a statement submitted by Bruno D.V. Marino, CEO and Founder of Planetary Emissions Management Inc., regarding the revisions to the Greenhouse Gas Reporting Rule (Subpart W) for the petroleum and natural gas industry. Marino expresses support for the revisions, particularly the focus on accuracy, empirical data, and direct measurement. He emphasizes the importance of differentiating between fossil and modern methane flux in commercial operations to reduce uncertainties in verifying actual net fossil fuel methane emission reductions and as a foundation for tradable emission offsets. Marino suggests that the analysis of radiomethane, or 14C CH4, could be a solution to the problem of accurately measuring fossil fuel perturbation to the climate system. He proposes the establishment of a central reference laboratory by a third party to ensure accuracy and traceability of radiomethane measurements. Marino also mentions that Planetary Emissions Management Inc. is developing radiomethane measurement technology and sensor system architecture that will provide a higher level of accuracy in distinguishing exact methane sources. In conclusion, Marino urges the Environmental Protection Agency (EPA) to encourage and allow the use of radiomethane measurement technology in achieving the goals of the Greenhouse Gas Reporting Rule revisions.","Explanation:
The sentiment of this document is positive with a score of 0.8. 

The document expresses support for the EPA's revisions to Subpart W of the Greenhouse Gas Reporting Rule, specifically highlighting the focus on accuracy, empirical data, and direct measurement. The author emphasizes the availability and cost-effectiveness of advanced emissions measurement technology. This positive sentiment is reflected in the statement that the revisions should encourage and allow the use of radiomethane measurement technology to achieve the EPA's goals.

The document also raises a concern about the differentiation of fossil versus modern CH4 flux for a commercial operation, which should be addressed in the revisions. This concern is expressed in a constructive manner, indicating a desire for improved accuracy and reliability in verifying actual net fossil fuel CH4 emission reductions and tradable emission offsets.

Overall, the document presents a positive perspective on the EPA's revisions and proposes a potential solution to address uncertainties in emissions measurement.",0.8
