company,summary,sentiment,summary_validation,sentiment_explanation,sentiment_score
"Providence Photonics, LLC","The document being summarized is a comment submitted by Providence Photonics, LLC in response to the proposed revisions to the Greenhouse Gas Reporting Rule for Petroleum and Natural Gas Systems. Providence Photonics is a developer of technologies related to flare efficiency measurement and gas leak detection in the oil and gas industry.

The comment begins by highlighting Providence Photonics' expertise in developing technologies such as Video Imaging Spectral Radiometry (VISR) for measuring flare performance and optical gas imaging for gas leak detection. They state that they have accumulated a substantial body of knowledge related to flare efficiency and its measurement.

The comment then focuses on two specific aspects of the proposed rule: flare combustion efficiency and flare flowrate measurement.

Regarding flare combustion efficiency, the comment discusses the difference between Combustion Efficiency (CE) and Destruction Efficiency (DE). CE refers to the fraction of hydrocarbon fuel oxidized to carbon dioxide, while DE refers to the fraction of hydrocarbon fuel destroyed, which may or may not be fully oxidized to carbon dioxide. The comment argues that lumping CE and DE together as ""combustion efficiency"" in the proposed rule is inconsistent with other flare regulations and suggests using DE for methane emission calculations and CE for carbon dioxide emission calculations.

The comment also suggests revising the proposed tiered approach for determining flare combustion efficiency. They propose allowing GHG reporters to directly measure DE using validated methods or implementing continuous monitoring of flare Net Heating Value Combustion Zone (NHVcz) and using bracketed DE values based on NHVcz. They argue that the proposed tiered approach may underestimate flare control efficiency and overestimate methane emissions.

Regarding flare flowrate measurement, the comment suggests allowing the use of VISR-based remote flare gas flowrate measurement as an alternative to flowmeters. They argue that this method can provide more accurate flowrate measurements, especially for flares without flowmeters or when flowrates are very low.

Lastly, the comment suggests using the VISR device to monitor the presence of the pilot flame in flares, as it is a maintenance-free method that can be combined with continuous monitoring of NHVcz and flow measurement.

The comment references several exhibits, including supporting data in Excel format, a technical presentation on VISR, EPA-sponsored VISR method testing, aggregated results of flare performance, and flare gas flowrate measurement by VISR.

Overall, the comment provides detailed recommendations for improving the proposed rule's approach to flare combustion efficiency and flowrate measurement, based on Providence Photonics' expertise and field experience in the oil and gas industry.",positive,"Based on the text provided, the statement is true. The document being summarized is a comment submitted by Providence Photonics, LLC in response to the proposed revisions to the Greenhouse Gas Reporting Rule for Petroleum and Natural Gas Systems. Providence Photonics is a developer of technologies related to flare efficiency measurement and gas leak detection in the oil and gas industry. The comment highlights Providence Photonics' expertise in developing technologies such as Video Imaging Spectral Radiometry (VISR) for measuring flare performance and optical gas imaging for gas leak detection. The comment provides detailed recommendations for improving the proposed rule's approach to flare combustion efficiency and flowrate measurement, based on Providence Photonics' expertise and field experience in the oil and gas industry.","Explanation:
The sentiment of this document is positive with a score of 0.6. This is because the document discusses the expertise and knowledge of Providence Photonics, LLC in developing technologies relevant to the proposed rule. It highlights their successful development of the Video Imaging Spectral Radiometry (VISR) technology and their experience in flare efficiency measurement and leak detection. The document also provides comments and relevant data on the proposed rule, suggesting improvements and alternative methods for measuring flare combustion efficiency and flow rate. Overall, the document expresses a positive tone towards the subject matter.",0.6
Alaska Oil and Gas Association (AOGA),"The document is a letter from the Alaska Oil and Gas Association (AOGA) to the United States Environmental Protection Agency (EPA) regarding proposed revisions and confidentiality determinations for petroleum and natural gas systems under the Greenhouse Gas Reporting Rule. AOGA provides comments on several areas of the proposed rule, including destruction efficiency for turbine compressor-drivers, the definition of ""pipeline quality gas"" for combustion emission units, the definition of ""centralized oil production site,"" natural gas turbine crankcase venting, reporting ""other large release events,"" and the definition and scope of the ""gathering and boosting"" segment.

In regards to destruction efficiency for turbine compressor-drivers, AOGA supports the incorporated destruction efficiency for turbine compressor drivers of 0.999 within the proposed rule. 

AOGA suggests that the EPA should define ""pipeline quality gas"" for combustion emission units located within the Onshore Petroleum and Natural Gas Production and Onshore Petroleum and Natural Gas Gathering and Boosting sectors. They propose adopting a definition based on the existing definitions of ""Natural Gas"" and ""Pipeline Natural Gas"" from EPA regulations developed for the Acid Rain Program.

AOGA requests that the EPA revises the definition of ""centralized oil production site"" to clarify that process tanks are not considered storage tanks. They propose a definition for ""process tank"" to provide clarity and consistency with other similar storage tank/vessel rules in EPA regulations.

Regarding natural gas turbine crankcase venting, AOGA argues that natural gas turbines should not be included for reporting crankcase venting as there are no crankcase vents on natural gas turbines. They propose that any leakage would be reported as fugitive emissions to avoid double counting of emissions.

AOGA suggests that source-specific reports should not exclude emissions from ""other large release events"" as it could dilute the data associated with those source types. They propose revisions to the language to clarify reporting requirements for other large release events.

Lastly, AOGA provides clarification on the definition and scope of the gathering and boosting segment, particularly in relation to central facilities in Alaska. They explain that central facilities do not meet the definition of the Onshore Petroleum and Natural Gas Gathering and Boosting industry segment and should continue to report emissions under Part 98 Subpart C.

Overall, the document provides detailed comments and suggestions from AOGA on various aspects of the proposed revisions and confidentiality determinations for petroleum and natural gas systems under the Greenhouse Gas Reporting Rule.",positive,"Based on the text provided, the statement is true. The document is indeed a letter from the Alaska Oil and Gas Association (AOGA) to the United States Environmental Protection Agency (EPA) regarding proposed revisions and confidentiality determinations for petroleum and natural gas systems under the Greenhouse Gas Reporting Rule. The letter includes AOGA's comments on various areas of the proposed rule, including destruction efficiency for turbine compressor-drivers, the definition of ""pipeline quality gas"" for combustion emission units, the definition of ""centralized oil production site,"" natural gas turbine crankcase venting, reporting ""other large release events,"" and the definition and scope of the ""gathering and boosting"" segment.","Explanation:
The sentiment of this document is positive with a score of 0.2. The document is a formal letter from the Alaska Oil and Gas Association (AOGA) addressing proposed revisions and confidentiality determinations for petroleum and natural gas systems. The tone of the letter is professional and respectful, and the content focuses on providing comments and suggestions for the proposed rule. There is no strong emotional language or negative sentiment expressed in the document. However, the sentiment score is not significantly positive as the document mainly consists of technical information and specific requests, which limits the overall positivity of the content.",0.2
David Allen,"The document is a comment submitted by Dr. David Allen, an environmental scientist specializing in oil and gas, on the Environmental Protection Agency's (EPA) proposal for the ""Greenhouse Gas Reporting Rule: Revisions and Confidentiality Determinations for Petroleum and Natural Gas Systems."" Dr. Allen provides expertise on methane emissions from oil and gas operations.

The comment is divided into five sections:

1. Project Astra Overview: Dr. Allen describes Project Astra, a network of fixed methane emission monitors in the Permian Basin oil and gas production region in West Texas. The network has been monitoring emissions from approximately 50 production sites since 2022. The Permian Basin was chosen for this demonstration due to its large volume of production and simple topography. Project Astra operates as a regional network, taking advantage of the proximity of sites to enhance the advantages of a shared network of sensors.

2. Methane Sensor/Monitor Characterization and Testing: Dr. Allen explains that Project Astra is developing an innovative sensor network using advances in methane-sensing technologies, data sharing, and data analytics. The project has completed sensor testing, evaluating seven solar-powered methane sensing systems for nine months at a production site in the Permian Basin. Four sensor systems demonstrated sufficient precision to detect emissions of 5-100+ kg/hr under meteorological conditions in the region.

3. Monitoring Network Design: The design of the monitoring network depends on the emission rate to be detected. The initial design of the network was based on dispersion modeling of emissions from each site in the test region. Simulations indicate that less than one continuous monitor per site is capable of consistently detecting emissions in the range of 100 kg/hr within an average of less than one day of the onset of emissions.

4. Detecting and Estimating the Duration of Large Release Events: Dr. Allen discusses how continuous monitoring systems like Project Astra can detect large methane release events. Case studies using dispersion modeling and meteorological data from Project Astra show that even with just one continuous sensor deployed per site, the average time required to detect a large emission event (100 kg/hr) is less than a day.

5. Summary of Main Points: The comment summarizes the main points, including the performance of the sensor systems tested in Project Astra, the capability of the monitoring network to detect emissions in the Permian Basin, and the efficiency of continuous monitoring systems in detecting large release events.

The document does not specifically mention continuous emissions monitoring, alternative technologies, IRA, congressional intent, harmonize, arbitrary and capricious.",positive,"Based on the text provided, the statement is true. The document is a comment submitted by Dr. David Allen, an environmental scientist specializing in oil and gas, on the EPA's proposal for the ""Greenhouse Gas Reporting Rule: Revisions and Confidentiality Determinations for Petroleum and Natural Gas Systems."" Dr. Allen provides expertise on methane emissions from oil and gas operations. The comment is divided into five sections, which discuss Project Astra, methane sensor/monitor characterization and testing, monitoring network design, detecting and estimating the duration of large release events, and a summary of the main points. The document does not mention continuous emissions monitoring, alternative technologies, IRA, congressional intent, harmonize, arbitrary and capricious.","Explanation:
The sentiment of this document is positive with a score of 0.8. This is because the document provides information about Project Astra, a continuously operating methane monitoring system, and its effectiveness in detecting and estimating the duration of large release events in the Permian Basin oil and gas production region. The document highlights the successful testing and deployment of sensor systems, the design of the monitoring network, and the detection capabilities of the system. The information presented in the document demonstrates the potential of Project Astra in improving methane emissions monitoring and contributes to the overall goal of reducing greenhouse gas emissions.",0.8
Colorado Department of Public Health and Environment (CDPHE),"The document is a comment submitted by the Colorado Department of Public Health and Environment, Air Pollution Control Division (CDPHE), to the U.S. Environmental Protection Agency (EPA) regarding the proposed revisions to the 'Greenhouse Gas Reporting Rule: Revisions and Confidentiality Determinations for Petroleum and Natural Gas Systems' (Docket Number: EPA-HQ-OAR-2023-0234). The comment addresses four specific areas covered by the proposed revisions: 1) the use of direct measurement options to improve the national greenhouse gas inventory, 2) the focus on basin-wide emissions reconciliation, 3) incentivizing operators to conduct robust methane measurement and monitoring, and 4) specific comments on emission calculation methods proposed by EPA.

CDPHE supports EPA's proposed addition of methods that require direct measurement of emissions and/or actual operating condition data to better characterize greenhouse gas emissions. They encourage the use of multi-scale measurements as each technology provides valuable information that supports an improved and more accurate inventory.

CDPHE considers inclusion of source or facility level emission monitoring critical to long-term emission accuracy, but basin-wide monitoring is a necessary and achievable effort in the near-term. They are developing a methodology with academic partners to develop basin-wide default factors that represent the amount of un- or under-reported emissions, which would improve operator understanding of their emissions contributions.

CDPHE suggests EPA consider how best to incentivize operators to conduct methane and parametric monitoring, similar to what Colorado has done for GHG emissions intensity. They believe operator-specific programs are critical to the success of GHG reduction efforts and encourage the use of technology-agnostic measurement techniques.

CDPHE provides technical comments and recommendations on various aspects of the proposed revisions, including disaggregating reporting requirements, storage tank emissions, combustion equipment, other large release events, and crankcase venting emissions. They support certain proposed changes and suggest improvements or alternatives in some areas.

Overall, CDPHE commends EPA for its efforts to develop and improve the quantification of greenhouse gas emissions and expresses their willingness to support EPA in the development of the rule. They emphasize the importance of reducing GHG emissions from the oil and gas industry and offer their contact information for further discussion.

The document does not specifically mention continuous emissions monitoring, alternative technologies, the IRA (Information Quality Act), congressional intent, harmonization, or arbitrary and capricious actions.",positive,"Based on the text provided, the statement is true. The document is a comment submitted by the Colorado Department of Public Health and Environment, Air Pollution Control Division (CDPHE), to the U.S. Environmental Protection Agency (EPA) regarding the proposed revisions to the 'Greenhouse Gas Reporting Rule: Revisions and Confidentiality Determinations for Petroleum and Natural Gas Systems' (Docket Number: EPA-HQ-OAR-2023-0234). The comment addresses four specific areas covered by the proposed revisions, including the use of direct measurement options to improve the national greenhouse gas inventory, focus on basin-wide emissions reconciliation, incentivizing operators to conduct robust methane measurement and monitoring, and specific comments on emission calculation methods proposed by EPA. The CDPHE supports EPA's proposed addition of methods that require direct measurement of emissions and/or actual operating condition data to better characterize greenhouse gas emissions. They also emphasize the importance of reducing GHG emissions from the oil and gas industry and offer their support to EPA in the development of the rule.","Explanation:
The sentiment of this document is positive with a score of 0.6. 

The document expresses support and appreciation for the U.S. Environmental Protection Agency's (EPA) ongoing efforts to develop and improve the quantification of greenhouse gas emissions. It recognizes the importance of the Greenhouse Gas Reporting Rule in improving understanding of emitting sources and acknowledges the opportunity to provide comments on the proposed rule.

The document addresses four specific areas covered by the proposed revisions, showing a constructive approach towards improving the national greenhouse gas inventory. It supports the use of direct measurement options to better characterize emissions and encourages the use of multi-scale measurements. It also emphasizes the importance of basin-wide emission monitoring and incentivizing operators to conduct robust methane measurement and monitoring.

Furthermore, the document provides technical comments and recommendations on specific emission calculation methods proposed by the EPA. It supports proposed changes to disaggregate reporting requirements and the extension of more accurate methane slip emission factors to all internal combustion equipment. It also suggests improvements in reporting requirements for other large release events and crankcase venting emissions.

Overall, the document demonstrates a positive sentiment towards the EPA's proposed revisions and expresses a willingness to support the EPA in reducing greenhouse gas emissions from the oil and gas industry.",0.6
National Association of Manufacturers (NAM),"The document is a letter from Brandon Farris, the Vice President of Energy & Resources Policy at the National Association of Manufacturers (NAM), addressed to the U.S. Environmental Protection Agency (EPA). The letter is in response to the EPA's Greenhouse Gas Reporting Rule proposal.

The NAM represents nearly 14,000 manufacturers in various sectors across all 50 states. The association emphasizes its commitment to protecting the health, safety, and vibrancy of communities. The NAM states that its members are leaders in environmental stewardship and sustainability, while also driving economic growth and prosperity.

The NAM supports a diverse approach to energy sources, including fossil fuels, nuclear, renewables, and energy technologies. They emphasize the importance of energy efficiency in meeting future energy demands. The NAM believes that government policies should prioritize reliability and preserve manufacturers' global competitiveness.

The letter highlights that petroleum and natural gas account for over two-thirds of power generated in the U.S. The NAM expresses concern that the EPA's targeting of these industries could jeopardize the reliable power supply that businesses and manufacturers rely on.

The NAM argues that the proposed rule is neither technically nor economically feasible. They claim that the EPA has not engaged with manufacturers and industry in setting achievable efficiency standards and has not considered the economic impact. The NAM suggests that jeopardizing the production of petroleum and natural gas could lead to gaps and lapses in power production and transmission.

The NAM concludes by stating that manufacturers are committed to being environmental stewards and working with the EPA on emission and efficiency standards. They emphasize the importance of avoiding gaps or lapses in energy supply.

The document does not mention continuous emissions monitoring, alternative technologies, IRA (Individual Retirement Account), congressional intent, harmonize, or arbitrary and capricious.",positive,"Based on the text provided, the statement is true. The document is indeed a letter from Brandon Farris, the Vice President of Energy & Resources Policy at the National Association of Manufacturers (NAM), addressed to the U.S. Environmental Protection Agency (EPA). The letter is in response to the EPA's Greenhouse Gas Reporting Rule proposal.","Explanation:
The sentiment of this document is positive with a score of 0.6. 

1. The document starts by introducing the National Association of Manufacturers (NAM) and their commitment to protecting the health, safety, and vibrancy of communities. This demonstrates a positive sentiment towards community well-being.

2. The document highlights the NAM's members' dedication to environmental stewardship and sustainability, emphasizing their commitment to progress. This indicates a positive sentiment towards environmental responsibility.

3. The NAM supports a diverse approach to powering communities and operations, recognizing the importance of energy efficiency and the responsible development and use of all energy sources. This demonstrates a positive sentiment towards a balanced and sustainable energy strategy.

4. The document expresses concern about the EPA's targeting of petroleum and natural gas industries, as they are major sources relied upon by U.S. businesses and manufacturers. This indicates a negative sentiment towards potential disruptions in power supply.

5. The document criticizes the proposed EPA rule for setting standards that are deemed technically and economically infeasible. It suggests that the EPA should consider all fuel and energy sources, including petroleum and natural gas, when pursuing emissions and efficiency standards. This expresses a negative sentiment towards the EPA's approach and a positive sentiment towards a more comprehensive and achievable strategy.

6. The conclusion reiterates the commitment of manufacturers to be environmental stewards and work closely with the EPA to ensure a reliable energy supply. This reinforces the positive sentiment towards collaboration and environmental responsibility.

Overall, the document expresses a generally positive sentiment towards environmental stewardship, sustainability, and collaboration, with some concerns about potential disruptions in power supply and the feasibility of proposed regulations.",0.6
