company,summary,sentiment,summary_validation,sentiment_explanation,sentiment_score
American Exploration and Production Council (AXPC),"The document is a letter submitted by the American Exploration and Production Council (AXPC) to the US Environmental Protection Agency (EPA). The letter requests an extension of the public comment period for EPA's Proposed Greenhouse Gas Reporting Rule: Revisions and Confidentiality Determinations for Petroleum and Natural Gas Systems. 

AXPC acknowledges the importance of the EPA's leadership in establishing industry-wide greenhouse gas quantification methodologies and expresses gratitude for the opportunity to provide input. However, due to the technical nature of the proposal and the need for thorough analysis, AXPC requests a 60-day extension of the public comment period. They believe that such an extension is necessary to understand the basis of the proposed changes, identify any challenges or unintended consequences, and assess the potential impacts within the larger regulatory context.

AXPC represents 34 independent oil and natural gas exploration and production companies in the United States. They emphasize their commitment to safety, science, and technological advancement, as well as their dedication to delivering affordable, reliable energy while positively impacting the economy and communities. AXPC recognizes the importance of improving the accuracy and reliability of greenhouse gas emissions inventory from the oil and gas sector, supporting the EPA's goal of providing high-quality, scientifically based data and reducing emissions.

The proposed changes by the EPA are described as highly technical and extensive, consisting of over 600 pages of preamble, proposed rule, technical support documents, and impact analysis. AXPC highlights that these changes intersect with other rulemakings in development, potentially leading to inconsistencies or conflicts. They also mention the implementation of the Waste Emissions Charge in the Inflation Reduction Act, which could have unintended impacts on the industry and the economy. AXPC argues that analyzing the interaction between multiple rules and identifying unintended consequences requires considerable time and complex analysis.

The letter concludes by stating that an extension of the public comment period is justified to allow stakeholders sufficient time to conduct extensive analysis and provide meaningful comments. AXPC urges the EPA to extend the comment period by 60 days to ensure the finalization of the rules is improved through stakeholder input.

Topics covered in the document include the technical nature of the proposed changes, potential unintended impacts on the industry and economy, the need for thorough analysis, and the request for an extension of the public comment period. The document does not mention continuous emissions monitoring, alternative technologies, IRA (Inflation Reduction Act), congressional intent, harmonize, arbitrary and capricious.",positive,"Based on the text provided, the statement is true. The document is indeed a letter submitted by the American Exploration and Production Council (AXPC) to the US Environmental Protection Agency (EPA), requesting an extension of the public comment period for EPA's Proposed Greenhouse Gas Reporting Rule: Revisions and Confidentiality Determinations for Petroleum and Natural Gas Systems. The letter acknowledges the technical nature of the proposal, the need for thorough analysis, and the potential impacts within the larger regulatory context. AXPC emphasizes its commitment to safety, science, and technological advancement, as well as its dedication to delivering affordable, reliable energy while positively impacting the economy and communities. The letter concludes by urging the EPA to extend the comment period by 60 days to ensure stakeholder input improves the finalization of the rules.","Explanation:
The sentiment of this document is positive with a score of 0.4. 

The document begins by expressing gratitude towards the Environmental Protection Agency (EPA) for its leadership in establishing industry-wide greenhouse gas quantification methodologies. This indicates a positive sentiment towards the EPA's efforts in addressing climate change and promoting environmental protection.

The document then requests a 60-day extension of the public comment period for EPA's proposed greenhouse gas reporting rule. The request is made respectfully and acknowledges the technical nature of the proposal, the need for thorough analysis, and the potential impacts of the proposed changes. This demonstrates a reasonable and cooperative tone, further supporting the positive sentiment.

The document also highlights the importance of regulatory policy that enables continued progress in environmental and public welfare outcomes, responsible stewardship of natural resources, and innovation and collaboration in the oil and gas industry. This indicates a positive attitude towards balancing environmental concerns with economic growth and job creation.

Overall, the document expresses support for the EPA's goals, acknowledges the importance of accurate greenhouse gas data, and emphasizes the need for careful analysis and stakeholder input. These factors contribute to the positive sentiment reflected in the score of 0.4.",0.4
"EnerVest Operating, LLC","The document is a comment submitted by EnerVest Operating, L.L.C. regarding proposed changes to Subpart W, OOOOb, OOOOc, and the methane waste taxes outlined in the Inflation Reduction Act and the Methane Emissions Reduction Program. EnerVest is an independent oil and natural gas operator with producing wells in Texas and Virginia, and they believe that these proposed changes will have a severe impact on their operations unless changes and clarifications are made to limit the impact on conventional marginal wells.

EnerVest supports the comments submitted by the Independent Petroleum Association of America and does not restate those arguments in their own comments. However, they provide additional comments on various aspects of the proposed changes.

They argue that the emission factors are increasing dramatically under the proposed changes without any basis in factual studies. They also believe that the time and cost estimates for implementing the revised regulations underestimate the additional burden and cost. They criticize the inclusion of water tank emissions in the revised rule, stating that these emissions are historically very low, difficult to measure, and have little impact on overall emissions reduction.

EnerVest also expresses concerns about the super emitter proposal, which allows third parties without training or licensure to allege super emissions, leading to costly reviews and responses. They argue that there are no changes or proposals that benefit or protect marginal conventional wells as intended by Congress. They give an example of eliminating factors for Eastern wells versus Western wells, which they believe is detrimental to marginal conventional wells.

The document also discusses specific aspects of the proposed rules, including engine methane emission factors, water tank emissions factors, intermittent bleed devices, liquid unloading, compressor venting, dump valves, and gathering and boosting. For each of these aspects, EnerVest provides their comments and suggestions for alternative approaches.

They also argue that the proposed changes do not address assumed emissions from pipelines in the Gathering & Boosting segment based solely on the miles of pipeline operated. They believe that emissions should be based on observed leaks and whether those leaks were repaired or not, rather than assuming emissions based on the miles of pipeline. They argue that responsible operators inspect their pipelines and repair leaks, and the regulations should only use emissions that are not repaired.

Finally, EnerVest urges the EPA to limit the definition of ""facility"" for oil and natural gas operations when calculating exceptions to the Methane Tax. They propose that a facility should be defined as a well pad site, whether for a single well or multiple wells, rather than including an entire basin as one facility.

Overall, EnerVest believes that unless changes are made to the proposed regulations, marginal well operators will be severely and irreparably damaged. They call for sensible amendments to Subpart W and the Methane Tax to protect their operations.",negative,"Based on the text provided, the statement is true. The document is a comment submitted by EnerVest Operating, L.L.C. regarding proposed changes to Subpart W, OOOOb, OOOOc, and the methane waste taxes outlined in the Inflation Reduction Act and the Methane Emissions Reduction Program. EnerVest is an independent oil and natural gas operator with producing wells in Texas and Virginia, and they believe that these proposed changes will have a severe impact on their operations unless changes and clarifications are made to limit the impact on conventional marginal wells. The document discusses various aspects of the proposed changes and provides comments and suggestions for alternative approaches. EnerVest also expresses concerns about the super emitter proposal and argues that there are no changes or proposals that benefit or protect marginal conventional wells as intended by Congress.","Explanation:
The sentiment of this document is negative with a score of -0.6. The document contains several arguments and concerns raised by EnerVest Operating, L.L.C. regarding the proposed changes to Subpart W, OOOOb, OOOOc, and the methane waste taxes. The company expresses dissatisfaction with the proposed regulations, stating that they will have severe impacts on their operations and that the proposed changes do not benefit or protect marginal conventional wells. EnerVest raises multiple issues with the proposed rules, such as the lack of factual basis for increasing emission factors, underestimation of time and cost burdens, inclusion of water tank emissions with little impact on overall emissions, unmerited super emitter allegations, and the need for more accurate measurement methods for various factors. The document also highlights concerns about the feasibility and cost of measuring liquid unloading, the burden of routine inspections, and the need for more accurate measurement of pipeline emissions. Overall, the document expresses a negative sentiment towards the proposed changes and raises multiple concerns and criticisms.",-0.6
Kirk Frost,"The document is a comment submitted to the EPA regarding Docket EPA–HQ–OAR–2023–0234, which addresses the reporting of greenhouse gas emissions in the oil and gas industry. The author expresses concern about the lack of accurate reporting of methane emissions from oil and gas facilities throughout the supply chain. They highlight the various sources of emissions, including wells, processing plants, pipelines, and distribution segments, and argue that these emissions are not being properly captured in the EPA's greenhouse gas emissions database.

The author commends the EPA for reviewing the current state of greenhouse gas reporting in the oil and gas industry but expresses frustration with the lack of corrective action taken by regulatory agencies in response to falsified emissions reports. They argue that facility owners purposely underreport emissions by taking advantage of loopholes in reporting requirements, such as not reporting blowdowns, venting, and fugitive emissions below a certain threshold.

The author suggests several changes to improve emissions reporting, including eliminating loopholes, mandating the inclusion of all emission sources and types in annual reports, and requiring accurate measurements of methane emissions in weight and volume. They also recommend monitoring FERC dockets for turbine specifications and addressing the issue of unburned methane emissions from natural gas-fired turbines.

The author calls for the EPA to establish an audit team to work with state DEPs in ensuring accurate reporting from natural gas facilities. They also propose a shorter reporting timeframe for events such as blowdowns and advocate for an awareness campaign to Congress and the public about the gap between reported and actual emissions in the oil and gas industry.

The author mentions the comment submitted by API, which claims that implementing the proposed rules would be costly. They argue that there are cost-effective approaches, such as using existing monitoring systems and log files, to report emissions accurately without significant increases in cost or labor.

The document does not specifically mention continuous emissions monitoring, alternative technologies, IRA, congressional intent, harmonize, or arbitrary and capricious.",negative,"Based on the text provided, the statement is true. The document is a comment submitted to the EPA regarding Docket EPA–HQ–OAR–2023–0234, which addresses the reporting of greenhouse gas emissions in the oil and gas industry. The author expresses concern about the lack of accurate reporting of methane emissions from oil and gas facilities throughout the supply chain. They highlight various sources of emissions and argue that these emissions are not being properly captured in the EPA's greenhouse gas emissions database. The author suggests several changes to improve emissions reporting and calls for the EPA to establish an audit team to ensure accurate reporting. They also mention a comment submitted by API, which claims that implementing the proposed rules would be costly.","Explanation:
The sentiment of the document is negative with a score of -0.6. This is because the document expresses concerns and criticisms regarding the reporting and accountability of methane emissions in the oil and gas industry. The author highlights the lack of accurate reporting, underreporting of emissions, and loopholes that enable facility owners to avoid reporting accurate emissions. The author also criticizes the fossil fuel industry for requesting an extension of time for comments and exaggerating the costs of implementing the proposed rules. Overall, the document conveys a negative sentiment towards the current state of greenhouse gas reporting and the actions of the oil and gas industry.",-0.6
Ovintiv Inc.,"The document is a letter submitted by Ovintiv Inc. to the U.S. Environmental Protection Agency (EPA) regarding the proposed revisions to Subpart W of the Greenhouse Gas Reporting Rule for Petroleum and Natural Gas Systems. Ovintiv is a company focused on reducing greenhouse gas emissions and supports revisions to the rule that improve the completeness and accuracy of GHG reports without imposing significant additional burden on reporters.

The letter addresses several specific elements of the proposed rulemaking. 

1. Flares: Ovintiv argues that the proposed changes regarding flares will impose costly monitoring requirements without providing improved accuracy. They request that the tiered control efficiency for flares be removed from the final rule and allow operators to claim the control efficiency that is most appropriate and justifiable.

2. Timing/Interrelatedness of Proposed Changes with Other Federal Regulations: Ovintiv points out that the proposed Subpart W requirements are related to other pending regulations and legislation, such as CAA Section 111(b) standards and emissions guidelines. They request that the EPA develop and communicate a plan to ensure coordination and synchronization of all associated regulations.

3. Designation of ""Gathering and Boosting"" versus ""Production"" segment: Ovintiv raises concerns about the classification of centralized oil production sites under the gathering and boosting segment. They recommend changing the name of the facility to ""centralized production facility"" and retaining the classification as onshore production to align with other federal programs.

4. Large Release Events: Ovintiv suggests using consistent terminology and thresholds for quantifying and reporting ""other large release events"" as defined in Subpart W and NSPS OOOOb.

5. Pneumatic Controllers: Ovintiv supports the proposed rule changes allowing for the use of site-specific measurement data to estimate emissions from pneumatic devices. They recommend including a default emission factor for intermittent bleed devices to reduce the resource-intensive nature of site-specific monitoring.

The letter concludes by expressing Ovintiv's appreciation for the opportunity to provide comments and adopting the specific technical comments submitted by the American Petroleum Institute (API) and the American Exploration and Production Council (AXPC). Ovintiv looks forward to working with the EPA in the continued development of these rules.

The document does not mention continuous emissions monitoring, alternative technologies, IRA, congressional intent, harmonize, arbitrary and capricious.",positive,"Based on the text provided, the statement is true. The document is a letter submitted by Ovintiv Inc. to the U.S. Environmental Protection Agency (EPA) regarding the proposed revisions to Subpart W of the Greenhouse Gas Reporting Rule for Petroleum and Natural Gas Systems. Ovintiv supports revisions to the rule that improve the completeness and accuracy of GHG reports without imposing significant additional burden on reporters. The letter addresses several specific elements of the proposed rulemaking, including flares, timing/interrelatedness of proposed changes with other federal regulations, designation of ""Gathering and Boosting"" versus ""Production"" segment, large release events, and pneumatic controllers. The document does not mention continuous emissions monitoring, alternative technologies, IRA, congressional intent, harmonize, arbitrary and capricious.","Explanation:
The sentiment of this document is positive with a score of 0.6. 

The document expresses appreciation for the opportunity to provide input on the proposed revisions to the Greenhouse Gas Reporting Rule and supports effective and reasonable revisions that balance the goal of improving GHG reports without imposing significant additional burden on reporters. The document also emphasizes the importance of aligning the final rule with other pending rules in order to minimize ambiguity and reduce the cost and complexity of compliance for operators. 

Overall, the document conveys a positive sentiment towards the proposed rulemaking and demonstrates a willingness to work with the EPA in the development of these rules.",0.6
Western Energy Alliance,"The document is a letter submitted to the U.S. Environmental Protection Agency (EPA) regarding the proposed revisions to the Greenhouse Gas Reporting Rule (GHGRP) for the petroleum and natural gas industry. The letter is written by the Western Energy Alliance, an organization representing independent oil and natural gas companies in the West.

The letter begins by stating that the proposed revisions to the GHGRP are unwieldy and would disincentivize the development and use of advanced technologies. The Alliance argues that the proposed rule is overly broad and fails to take into account the specific nature of the upstream sector. They also claim that the rule is not practicable or realistic and penalizes companies for using advanced technologies.

The Alliance offers an assessment of the proposed revisions and provides specific recommendations for how to correct them. They argue that the upstream and production segment of the oil and natural gas industry should not be treated the same as the midstream or downstream segments. They suggest that the GHGRP should allow for flexibility in the technologies used to collect and report data, such as aircraft, drones, satellites, and other full-field measurement technologies.

The letter also highlights the potential conflicts between the proposed rule and other concurrent rulemakings at EPA and other federal agencies. The Alliance urges EPA to better coordinate its rulemaking efforts to ensure they work in harmony with each other.

The document goes on to discuss the overestimation of emissions that would result from the proposed rule. The Alliance cites an analysis by Enverus Intelligence Research, which estimates that the proposed revisions would increase methane emissions by 130% and CO2e emissions by 41%. The Alliance argues that these estimates are too conservative and that the actual increase in emissions would be even higher.

The letter concludes with source-specific comments and recommendations for improving the accuracy of emissions reporting for various sources, including compressors, equipment leaks, blowdowns, and storage tanks. The Alliance suggests changes to the proposed calculations and factors for these sources to ensure more accurate reporting.

Overall, the document expresses the Alliance's concerns about the proposed revisions to the GHGRP and provides specific recommendations for improving the rule to avoid misleading the public and penalizing operators.",negative,"Based on the text provided, the statement is true. The document is a letter submitted to the U.S. Environmental Protection Agency (EPA) regarding the proposed revisions to the Greenhouse Gas Reporting Rule (GHGRP) for the petroleum and natural gas industry. The letter is written by the Western Energy Alliance, an organization representing independent oil and natural gas companies in the West. The letter expresses the Alliance's concerns about the proposed revisions and provides specific recommendations for improving the rule. It discusses the potential disincentives for the development and use of advanced technologies, the broadness of the proposed rule, conflicts with other concurrent rulemakings, overestimation of emissions, and source-specific comments and recommendations for improving emissions reporting.","Explanation:
The sentiment of this document is negative with a score of -0.8. This is because the document expresses strong criticism and dissatisfaction with the proposed revisions to the Greenhouse Gas Reporting Rule. The document highlights several concerns and argues that the proposed rule is unwieldy, disincentivizes the use of advanced technologies, and would result in inaccurate overestimations of industry emissions. The document also points out conflicts with other rulemakings and raises issues of accuracy and overestimation of emissions. Overall, the document conveys a negative sentiment towards the proposed rule and its potential impact on the industry.",-0.8
